{
  "schema_version": 1,
  "status": "strict_installs_pass",
  "indexes": {
    "primary": "https://pypi.org/simple",
    "supplemental": "https://download.pytorch.org/whl/cpu"
  },
  "policy": {
    "hash_algorithm": "sha256",
    "only_binary": true,
    "require_hashes": true,
    "reject_editable_vcs_path": true,
    "include_tt_transformers": false,
    "required_torch": "2.11.0+cpu",
    "yaml_provided_by_base_closure": true
  },
  "locks": [
    {
      "target": "base-py310",
      "python": "3.10.19",
      "group": "base",
      "lock_path": "constraints/locks/base-py310.txt",
      "lock_sha256": "224ed4d1da7b50ec9c341489e64b54c462eda2e16dda8eac41f1c25de8f00f08",
      "package_count": 31,
      "requested_requirements": [
        "ttnn==0.77.0",
        "torch==2.11.0+cpu",
        "loguru==0.6.0"
      ],
      "resolver_report": {
        "sha256": "ac78a9b17ecbb2ef23310a2a84006d792e1fa8b3d0b908cf7cba380c3df99238",
        "pip_version": "23.0.1",
        "environment": {
          "implementation_name": "cpython",
          "implementation_version": "3.10.19",
          "os_name": "posix",
          "platform_machine": "x86_64",
          "platform_release": "4.18.0-553.el8_10.x86_64",
          "platform_system": "Linux",
          "platform_version": "#1 SMP Fri May 10 15:19:13 EDT 2024",
          "python_full_version": "3.10.19",
          "platform_python_implementation": "CPython",
          "python_version": "3.10",
          "sys_platform": "linux"
        }
      },
      "packages": [
        {
          "name": "click",
          "version": "8.5.0",
          "filename": "click-8.5.0-py3-none-any.whl",
          "url": "https://files.pythonhosted.org/packages/58/50/6c0d534c5f134586a8e1ba4e330569e32f057e33372ae556463212fb4cd3/click-8.5.0-py3-none-any.whl",
          "index": "pypi",
          "sha256": "255bc9599cf7748b4b1a446ccc735421bd08a2ae529a8b88597d3de5664ee360",
          "requested": false
        },
        {
          "name": "contourpy",
          "version": "1.3.2",
          "filename": "contourpy-1.3.2-cp310-cp310-manylinux_2_17_x86_64.manylinux2014_x86_64.whl",
          "url": "https://files.pythonhosted.org/packages/32/5c/1ee32d1c7956923202f00cf8d2a14a62ed7517bdc0ee1e55301227fc273c/contourpy-1.3.2-cp310-cp310-manylinux_2_17_x86_64.manylinux2014_x86_64.whl",
          "index": "pypi",
          "sha256": "ad687a04bc802cbe8b9c399c07162a3c35e227e2daccf1668eb1f278cb698631",
          "requested": false
        },
        {
          "name": "cycler",
          "version": "0.12.1",
          "filename": "cycler-0.12.1-py3-none-any.whl",
          "url": "https://files.pythonhosted.org/packages/e7/05/c19819d5e3d95294a6f5947fb9b9629efb316b96de511b418c53d245aae6/cycler-0.12.1-py3-none-any.whl",
          "index": "pypi",
          "sha256": "85cef7cff222d8644161529808465972e51340599459b8ac3ccbac5a854e0d30",
          "requested": false
        },
        {
          "name": "filelock",
          "version": "3.32.5",
          "filename": "filelock-3.32.5-py3-none-any.whl",
          "url": "https://files.pythonhosted.org/packages/36/d2/b70a31e13d04456d28493f31d2aa087e99eeb2767ef0293b2625727ccb8c/filelock-3.32.5-py3-none-any.whl",
          "index": "pypi",
          "sha256": "142cd9fa77a872c5e78c62329a0d15278fadc686eb89e760017968961a4fd6b2",
          "requested": false
        },
        {
          "name": "fonttools",
          "version": "4.64.0",
          "filename": "fonttools-4.64.0-cp310-cp310-manylinux2014_x86_64.manylinux_2_17_x86_64.whl",
          "url": "https://files.pythonhosted.org/packages/d6/93/515ea8d3f637450c4d354acbabea576ec977ab03684a775116a9e6e30fc3/fonttools-4.64.0-cp310-cp310-manylinux2014_x86_64.manylinux_2_17_x86_64.whl",
          "index": "pypi",
          "sha256": "d16102cbcd4615b09c64e6022733faccc93200785f1ab0d4493afb8b0261edde",
          "requested": false
        },
        {
          "name": "fsspec",
          "version": "2026.7.0",
          "filename": "fsspec-2026.7.0-py3-none-any.whl",
          "url": "https://files.pythonhosted.org/packages/fd/3c/6a2bf344106328fd04963664a60b9bb6496fc25df8e962fcdc1367285fb9/fsspec-2026.7.0-py3-none-any.whl",
          "index": "pypi",
          "sha256": "b57ddbafedfaef7018c1ecab32aa200a9d7ca26b77965f64e48b70061249d279",
          "requested": false
        },
        {
          "name": "graphviz",
          "version": "0.21",
          "filename": "graphviz-0.21-py3-none-any.whl",
          "url": "https://files.pythonhosted.org/packages/91/4c/e0ce1ef95d4000ebc1c11801f9b944fa5910ecc15b5e351865763d8657f8/graphviz-0.21-py3-none-any.whl",
          "index": "pypi",
          "sha256": "54f33de9f4f911d7e84e4191749cac8cc5653f815b06738c54db9a15ab8b1e42",
          "requested": false
        },
        {
          "name": "jinja2",
          "version": "3.1.6",
          "filename": "jinja2-3.1.6-py3-none-any.whl",
          "url": "https://files.pythonhosted.org/packages/62/a1/3d680cbfd5f4b8f15abc1d571870c5fc3e594bb582bc3b64ea099db13e56/jinja2-3.1.6-py3-none-any.whl",
          "index": "pypi",
          "sha256": "85ece4451f492d0c13c5dd7c13a64681a86afae63a5f347908daf103ce6d2f67",
          "requested": false
        },
        {
          "name": "kiwisolver",
          "version": "1.5.1",
          "filename": "kiwisolver-1.5.1-cp310-cp310-manylinux_2_12_x86_64.manylinux2010_x86_64.whl",
          "url": "https://files.pythonhosted.org/packages/f1/0e/9f394d693be549fa3fab62498c2778294595991047adc3dcf10aa99b91c0/kiwisolver-1.5.1-cp310-cp310-manylinux_2_12_x86_64.manylinux2010_x86_64.whl",
          "index": "pypi",
          "sha256": "e05c2f7925f1d88778e53cb44f14e0223204a3bdd09a41664750363acfb1f2ef",
          "requested": false
        },
        {
          "name": "loguru",
          "version": "0.6.0",
          "filename": "loguru-0.6.0-py3-none-any.whl",
          "url": "https://files.pythonhosted.org/packages/fe/21/e1d1da2586865a159fc73b611f36bdd50b6c4043cb6132d3d5e972988028/loguru-0.6.0-py3-none-any.whl",
          "index": "pypi",
          "sha256": "4e2414d534a2ab57573365b3e6d0234dfb1d84b68b7f3b948e6fb743860a77c3",
          "requested": true
        },
        {
          "name": "markupsafe",
          "version": "3.0.3",
          "filename": "markupsafe-3.0.3-cp310-cp310-manylinux2014_x86_64.manylinux_2_17_x86_64.manylinux_2_28_x86_64.whl",
          "url": "https://download.pytorch.org/whl/markupsafe-3.0.3-cp310-cp310-manylinux2014_x86_64.manylinux_2_17_x86_64.manylinux_2_28_x86_64.whl",
          "index": "pytorch_cpu",
          "sha256": "f42d0984e947b8adf7dd6dde396e720934d12c506ce84eea8476409563607591",
          "requested": false
        },
        {
          "name": "matplotlib",
          "version": "3.10.9",
          "filename": "matplotlib-3.10.9-cp310-cp310-manylinux2014_x86_64.manylinux_2_17_x86_64.whl",
          "url": "https://files.pythonhosted.org/packages/fc/b7/d8bcec2626c35f96972bff656299fef4578113ea6193c8fdad324710410c/matplotlib-3.10.9-cp310-cp310-manylinux2014_x86_64.manylinux_2_17_x86_64.whl",
          "index": "pypi",
          "sha256": "1aa972116abb4c9d201bf245620b433726cb6856f3bef6a78f776a00f5c92d37",
          "requested": false
        },
        {
          "name": "ml-dtypes",
          "version": "0.5.4",
          "filename": "ml_dtypes-0.5.4-cp310-cp310-manylinux_2_27_x86_64.manylinux_2_28_x86_64.whl",
          "url": "https://files.pythonhosted.org/packages/10/b1/8938e8830b0ee2e167fc75a094dea766a1152bde46752cd9bfc57ee78a82/ml_dtypes-0.5.4-cp310-cp310-manylinux_2_27_x86_64.manylinux_2_28_x86_64.whl",
          "index": "pypi",
          "sha256": "388d399a2152dd79a3f0456a952284a99ee5c93d3e2f8dfe25977511e0515270",
          "requested": false
        },
        {
          "name": "mpmath",
          "version": "1.3.0",
          "filename": "mpmath-1.3.0-py3-none-any.whl",
          "url": "https://files.pythonhosted.org/packages/43/e3/7d92a15f894aa0c9c4b49b8ee9ac9850d6e63b03c9c32c0367a13ae62209/mpmath-1.3.0-py3-none-any.whl",
          "index": "pypi",
          "sha256": "a0b2b9fe80bbcd81a6647ff13108738cfb482d481d826cc0e02f5b35e5c88d2c",
          "requested": false
        },
        {
          "name": "networkx",
          "version": "3.4.2",
          "filename": "networkx-3.4.2-py3-none-any.whl",
          "url": "https://files.pythonhosted.org/packages/b9/54/dd730b32ea14ea797530a4479b2ed46a6fb250f682a9cfb997e968bf0261/networkx-3.4.2-py3-none-any.whl",
          "index": "pypi",
          "sha256": "df5d4365b724cf81b8c6a7312509d0c22386097011ad1abe274afd5e9d3bbc5f",
          "requested": false
        },
        {
          "name": "numpy",
          "version": "1.26.4",
          "filename": "numpy-1.26.4-cp310-cp310-manylinux_2_17_x86_64.manylinux2014_x86_64.whl",
          "url": "https://files.pythonhosted.org/packages/4b/d7/ecf66c1cd12dc28b4040b15ab4d17b773b87fa9d29ca16125de01adb36cd/numpy-1.26.4-cp310-cp310-manylinux_2_17_x86_64.manylinux2014_x86_64.whl",
          "index": "pypi",
          "sha256": "ffa75af20b44f8dba823498024771d5ac50620e6915abac414251bd971b4529f",
          "requested": false
        },
        {
          "name": "packaging",
          "version": "26.3",
          "filename": "packaging-26.3-py3-none-any.whl",
          "url": "https://files.pythonhosted.org/packages/63/34/ba1c580383c9eada3711951fef0795c80b829a078d72188184bcab9dd527/packaging-26.3-py3-none-any.whl",
          "index": "pypi",
          "sha256": "d7193f7c8e4e93f444fde0262bf90af30e16fa0ad0ad44cb553c87339b23cd1c",
          "requested": false
        },
        {
          "name": "pandas",
          "version": "2.3.3",
          "filename": "pandas-2.3.3-cp310-cp310-manylinux_2_24_x86_64.manylinux_2_28_x86_64.whl",
          "url": "https://files.pythonhosted.org/packages/40/a8/4dac1f8f8235e5d25b9955d02ff6f29396191d4e665d71122c3722ca83c5/pandas-2.3.3-cp310-cp310-manylinux_2_24_x86_64.manylinux_2_28_x86_64.whl",
          "index": "pypi",